6734843,Einar Bolt,29,False,74,C,Gift,2,2942 Skodsborg,Lærer,1,,3,,2,,3,,2,,2,,1,,2,,1,,2,,3,,2,,2,,0,,3,,3,,3,,1,,2,,2,,2,,3,,3,,2,,3,,2,,"Trafik, Kultur,  idræt og fritid, Ældre, Skole/dagtilbud for børn","Livet bestemmes ikke på Rådhuset, det skaber vi sammen i et forpligtet fællesskab.Lokalpolitik handler om hverdagen, lige der hvor vi bor.","Fire års oprydning efter Venstre har vist sig ikke at være nok.For de små handler det om, at sikre gode institutioner med nærvær og omsorg. Det skabes ikke ved at etablere store børnesiloer. Lad os i stedet bibeholde mindre og nærværende institutioner.På folkeskoleområdet skabes kvaliteten først og fremmest af dygtige og dedikerede lærere.  Opgaven er derfor at rekruttere og fastholde de gode lærere.   Arbejdsmarkedet - såvel det private som det offentlige - skal sikres optimale vilkår for virksomhedens drift og muligheder i fremtiden. Regulariteten på Kystbanen er bedre end ved sidste valg,  men tøj med høj indstigning duer ikke.  Tog og busser er for mange rygraden i en brugbar og attraktiv infrastruktur. Pensionisterne og de ældre indbyggere fortjener en god og tryg alderdom med mange aktiviteter både når det drejer sig om kultur som motion.Når livet er slut, bør prisen for en gravplads på en af kommunens kirkegårde ikke være en hindring for et værdigt eftermæle."
37186,Sirenetta Poulsen,41,False,58,C,Gift,2,2840 Holte,fagkonsulent,0,,4,,3,,4,,0,,4,,3,,2,,3,,2,,4,,3,,1,,3,,1,,3,,3,,3,,2,,1,,3,,3,,2,,3,,4,,4,,"Miljø og klima, Kultur,  idræt og fritid, Ældre, Sundhed, Beredskab og sikkerhed",Fordi jeg vil arbejde for at byudvikling tager hensyn til vores grønne områder.At der er fokus på livskvaliteten i vores kommune med mange tilbud til de ældre.,Fordi jeg vil have fokus på at bevare vores natur til glæde for os alle nu og i fremtiden. Fordi jeg vil arbejde for tryghed for de ældre med blandt andet de eksisterende aktivitetscentre.
120184244,Henrik Mordhorst,31,False,64,C,Samboende men ikke gift,0,2840 Holte,CFO,0,,4,,2,,4,,0,,3,,3,Hvor teknologi giver mening skal vi bruge det. Dette er et område med muligheder.,1,Mærker ikke problemet i dagligdagen.,2,,2,"Der er flere måder at bidrage til grøn omstilling. Information, nye rutiner og omtanke kan gøre væsentligt forskel mange steder.",4,,3,,2,,3,Kompetence og kvalifikationer bør være afgørende.,2,,4,,2,,4,Som del af et større fokus/mere information om sund kost.,1,,1,,3,,3,,3,,4,,3,,4,,"Trafik, Erhverv/administration, Beredskab og sikkerhed","For at sikre en fortsat sikker, grøn og veladminstreret kommune, med en sund økonomi.  Det giver råderum til at levere gode løsninger og god service.","For at sikre en fortsat sikker, grøn og veladminstreret kommune, med en sund økonomi.  Det giver råderum til at levere gode løsninger og god service."
3856,Lars V. Søndergaard-Nielsen,88,False,65,C,Gift,2,3460 Birkerød,Seniorpensionist,1,Det er ikke nødvendigt.,4,,1,,3,,2,,3,,2,"Nogen vil havde økonomiske mulighed for dette og kunne godt købe selv, andre har ikke denne mulighed  hvorfor de burde kunne søge om støtte.",1,,0,Vi skal se på trafik sikkerheden for alle typer trafik.,2,Det afhænger om hvordan dyrere.,3,,1,,1,,2,Men de skal kunne begå sig på dansk.,0,,3,"Der dukke med mellemrum problemer op som der skal tages hånd om, og rettes. Det er ikke altid sket.",1,,1,Det er en privat opgave,1,"Jeg er ikke rygere, siden 2009,  men der skal være plads til alle.",1,,1,,3,Hurtigere sagsbehandling.,1,,3,Kun hvis det er forsvarligt.,3,,4,,"Miljø og klima, Kultur,  idræt og fritid, Ældre, Skole/dagtilbud for børn, Skat","Jeg vil arbejde for, Respekt, anstændighed og værdig behandling af alle borgere grupper.  Fastholdelse af den grønne profil og vores landzoneområder samt tryghed, sikkerhed, kvalitet og stabilitet.","Jeg stiller op, fordi jeg gerne vil være med til at præge og udvikle Ruderdal kommune. Jeg vil i den forbindelse arbejde for, at Rudersdal kommune bliver stedet, hvor det er dejligt at vokse op, arbejde og blive gammel i. Vores kommune skal være kendetegnet ved en høj faglighed, højt serviceniveau, og som en kommune med en sund økonomi.  Jeg vil fastholde kommunens grønne profil og vores landzoneområder. Vi bor i en kommune med et rigt naturliv og landskabelige værdier. Vi skal sikre vores vandindvindings områder i kommunen. Vi skal sikre vores kommune imod forurening med spildevand fra kloaker, der ikke kan klare opgaven, ved at renovere dem og deres rørføring i tide. Jeg har siddet i Birkerød byråd 1991-2006. Det har lært mig hvor svært det kan være  at dele sol og vind lige. Især når der bliver flere og flere vigtige opgaver, der skal løses, og udgifterne samtidigt skal holdes i ro. BRUG DIN STEMME.  Stem personligt på Lars V. Søndergaard-Nielsen"
42839,Hanne Gerner Nielsen,25,False,84,C,Enlig,2,2850 Nærum,bestyrelses arbejder,0,,4,,3,,4,,0,,4,,3,,0,,3,,4,,3,,4,,2,,0,,2,jeg ved for lidt om området,3,,4,,0,jeg mener at forældre selv bør tage ansvar her,4,,0,,0,fordi jeg mere er tilhænger af en to lærerordning,4,,4,,4,,3,,4,,Ældre,"fordi det at være konservativ betyder at jeg vil stå ved mine ord, og helst vil optræde ordentligt overfor borgerne.",jeg mener at jeg er kendt som en positiv person med viljen til at gøre et stykke arbejde.
3832,Elisabeth Ildal,39,False,66,C,Gift,3,2840 Holte,Kommunalbestyrelsesmedlem,2,,4,,2,,4,,2,,3,,3,Det er hovedreglen men der er altid overvejelser,2,,3,Tilgængeligheden for mennesker med funktionsnedsættelser skal forbedres,3,,4,,3,,1,,3,Udenlandske medarbejdere med borgerkontakt skal kunne tale og forstå dansk,1,,3,,1,,3,,2,,2,,2,,4,,2,,4,,4,,3,,"Kultur,  idræt og fritid, Ældre, Sundhed, Skole/dagtilbud for børn, Skat","Hvis du ønsker frihed til at være forskellig, idet jeg forstår at politikerne er til for borgene. Jeg har orden i penalhuset og husker at behandle andre som man selv vil behandles.","Jeg har siddet i kommunalbestyrelsen i 12 år og når jeg træffer en beslutning spørger jeg altid mig selv først: ""vil jeg byde mine egne børn, min mor eller mig selv det her?"" Hvis ikke, så skal jeg heller ikke byde andre  det.Min ambitioner er, at sund økonomi går hånd i hånd med idrætten, børnene, de ældre, civilsamfundet og kernevelfærden!"
3878,Dorte Nørbo,537,True,66,F,Gift,1,2840 Holte,"Politik, kultur og formidling",2,"Skoler har stor betydning for lokalområderne. Men forventningen er, at antallet af børn og unge falder. Derfor er der ikke umiddelbart behov for mere kapacitet.  Vi skal derimod sikre, at de skoler vi har, er i god stand og indrettet sådan, at de formår at skabe høj faglig og social trivsel for alle børn og unge, også de sårbare.",4,"Fonden havde brugt alle sine penge.  Så der var ikke grundlag for at blive ved med den model, som stedet hvilede på.",2,"Begge områder er yderst vigtige.  Rammen for, hvor meget vi kan bruge på begge områder, bør udvides.  Der er behov for prioriteringer på begge områder.",4,"Der er brug for, at vi kan bruge flere penge på ældre, børn og unge. Rammen bør udvides.",0,"Fjernvarme er den kollektive, effektive varmeforsyning. Vi skal sikre, at det bliver grøn forsyning, der nedbringer CO2-udledningen for alle.",4,"Det vil være godt at komme i mål med separatkloakering så hurtigt som muligt.  Kommunen samarbejder med Novafos.  Hastigheden er et spørgsmål om kapacitet. Der skal være konstant fokus på at sikre at tidsplanen overholdes og vurdere, om den kan fremskyndes.",1,"Der er livskvalitet i, at en medarbejder kommer og støvsuger. Det kan en robotstøvsuger aldrig erstatte. Det vigtigste er den menneskelige kontakt.",4,Det er et godt incitament til at få folk til at investere i en mere CO2-neutral bil.,4,Vi skal sikre trygge forhold for de bløde trafikanter og for folk med handicap. Børn og unge skal kunne færdes sikkert og folk med handicap skal kunne komme frem. Der skal skabes mere plads til disse grupper både af hensyn til sikkerhed og til det sociale liv i byerne.,4,"Vi står over for enorme udfordringer med vores klima. Vi skal arbejde for, at vi overalt på kloden nedsætter udledningen af CO2. Vores primære ansvar er det, vi gør i denne kommune.",4,"Vi skal ikke inddrage hverken grøn kile, landbrugsarealer eller fredede områder for at bygge mere. Hvis vi skal bygge, skal det være i form af fortætninger i de byområder, vi allerede har udviklet.",4,"Det er vigtigt, at der er gode tilbud til børn og unge. Prioriteringen mellem det og andre områder kommer altid an på en konkret vurdering.",0,"Musik- og Billedskolen har haft mulighed for at gøre en meget stor forskel for mange børn gennem den bevilling, som SF har sikret. Idrætslivet har også fået bedre fysiske rammer.  Det er helt nødvendigt at prioritere disse områder. Det skaber samenhængskraft, livsglæde og er fundament for vores fælles samvær og samtale.",2,"Det kan være nødvendigt. Men det skaber mange udfordringer i ældreplejen, hvis folk ikke kan tale et forståeligt dansk. Det vil være bedre at se på de strukturelle udfordringer, der gør, at det er svært at rekruttere arbejdskraft til ubesatte stillinger.",0,Det er en af de svageste grupper i vores samfund. De skal hjælpes så godt som muligt.,3,"Det største problem er, at der mangler tilstrækkeligt med varme hænder. Vi skal have fokus på de nære teams og på gode arbejds- og uddannelsesmuligheder for de ansatte,  så vi kan tiltrække medarbejdere.  Den nære omsorg skal være i centrum.",1,"Der er brug for flere penge. Til flere hænder, til videreuddannelse af medarbejdere og generelt til bedre arbejdsvilkår, så vi kan tiltrække og fastholde medarbejdere.",3,"Det vil sikre, at alle børn og unge får et godt måltid. Det skaber et godt socialt samvær at spise sammen.Hvordan det skal finansieres er et spørgsmål, der skal drøftes.",2,Der er indført røgfri zoner på kommunens områder både indendørs og udendørs.  Det trådte i kraft 1. marts 2025.,4,"Det skal være muligt at få passet sit barn, selvom man har skæve arbejdstider.",3,Målet er 24 elever i en klasse.,4,"Bæredygtige videnserhverv er et af de erhverv, der bør tiltrækkes. Det er vigtigt, at der er arbejdspladser i kommunen. Det kan forhindre noget pendling og skabe en bedre balance mellem bolig og job.",2,"Det skal hele tiden vurderes,  om der er den rette mængde ansatte.",1,"Vi har ikke en høj kommuneskat. Skatten sikrer, at der er penge nok, men det kræver også, at vi må bruge pengene.",3,"Problemer med støj for de borgere, der bor tæt på befærdede veje er ikke prioriteteret højt nok.  Der skal afsættes mere til trafikløsninger,  især de sikre skoleveje samt bymiljøer, hvor der er plads til mennesker frem for biler.  Kulturlivet skal også tilgodeses mere til gavn for livet i byerne. Musikskolen skal også fortsat have mulighed for at samarbejde med skoler og daginstitutioner.  Det er med til at øge trivslen for et stort antal børn og unge.  SFO skal prioriteres højere.  Både mht. normeringer og de fysiske miljøer. Det skal ældreområdet også, både plejecentre og hjemmeplejen, skal tilgodeses mere i de kommende budgetter. Teams, så de ældre kender dem, der tager sig af dem,   og flere hænder. Vi skal også prioritere væresteder for ældre. Der er fortsat behov for at prioritere det specialiserede område, daginstitutioner og  skoler.",4,,"Trafik, Miljø og klima, Kultur,  idræt og fritid, Ældre, Skole/dagtilbud for børn","Klima, miljø og biodiversitet er vigtig.  Børns og unges trivsel. Gode institutioner, og gode fritidsmuligheder. Kunst og kultur skaber trivsel, samvær og dialog. En værdig ældrepleje er central.","Klima, miljø og biodiversitet er vores livsgrundlag. Vi skal fortsat arbejde for at nedbrigne vores CO2-udslip. Vi skal sikre rent vand at drikke, rent vand i vores søer, åer og hav og flere områder med høj biodiversitet og sammenhængende natur. Det er grundlaget for både bæredygtighed og trivselVores børn bruger meget tid i daginstitutioner, skoler og SFO.  Alle børn og unge har brug for, at kvaliteten er høj, både de mere sårbare og alle andre. Kultur er både kunst og idræt. Der er brug for begge dele. Det er glæde, trivsel, leg, nysgerrighed og sammenhængskraft. Det skal vi styrke. En værdig ældrepleje - vi kan ikke være andet bekendt.  Vi skal have reelle faste teams på plejehjem og i hjemmeplejen. Vi skal have flere varme hænder og sikre, at vi giver arbejdsvilkår, der tiltrækker personale, som også har lyst til at blive. Kernevelfærd er en kommunal opgave, et fælles ansvar. Vi skal udvikle boliger og væresteder for ældre borgere som værn mod ensomhed"
6644279,Martin Rosenkilde,260,False,55,F,Gift,2,3460 Birkerød,International Chef,2,"Jeg mener, at alle børn i Rudersdal skal have en god skole tæt på, hvor de bor - men nye bygninger er ikke altid svaret. Vi skal først og fremmest sikre kvaliteten i undervisningen, gode lærere og trygge rammer. Hvis der viser sig et reelt behov for flere skolepladser, skal vi naturligvis handle, men vi vil ikke acceptere, at det sker på bekostning af andre velfærdsområder som ældreplejen eller daginstitutionerne. For SF handler det om at løfte fællesskabet på tværs - ikke at sætte velfærden op mod hinanden.",3,"Fordi det var meget dyrt for kommunen at drive Gl. Holtegaard, og derfor er det en stor gevinst, at vi nu har fundet en løsning med Danish Research Foundation. Det markerer en ny og spændende æra, hvor stedet bliver en dynamisk kulturinstitution med både danske og internationale kunstnere - samtidig med at barokhaven fortsat er gratis tilgængelig for alle, og vi kan se frem til en ny skulpturpark.",2,"Det giver ingen mening at stille ældre og børn op mod hinanden. SF i Rudersdal vil både styrke ældreplejen og sikre kvaliteten i vores skoler - for begge dele er kernevelfærd, som borgerne har krav på. På ældreområdet skal vi især have mere tid og nærvær i hverdagen, og på skoleområdet skal vi sikre gode rammer, så børn kan trives og lære. Det handler ikke om enten-eller, men om både-og, og om at vi som kommune prioriterer fællesskabet frem for at spare på de områder, der betyder mest i borgernes liv.",3,"Jeg er tryg ved, at der er styr på Rudersdals økonomi - derfor har vi også mulighed for at investere mere målrettet i at beskytte børn og unge, ældre og vores vandmiljø og natur.",0,"Nej - tværtimod. Vi skal fortsætte og gerne fremskynde udrulningen af fjernvarme i Rudersdal. Det er en af de vigtigste investeringer, vi kan lave for at nå klimamålene og give borgerne en mere stabil og billigere varmeløsning på sigt. At stoppe nu vil være dyrt, kortsigtet og en bjørnetjeneste både for klimaet og for husejerne. Selvfølgelig skal det ske i tæt dialog med borgerne, så løsningerne bliver grønne, økonomisk forsvarlige og til at leve med i hverdagen.",3,"Vi er nødt til at tage spildevandsproblemerne alvorligt, for de rammer både vores miljø, sundhed og livskvalitet. Jeg mener, at kommunen skal prioritere grønne løsninger og investeringer, der mindsker overløb og forurening - men vi skal gøre det klogt og socialt ansvarligt. Det betyder, at vi ikke vil finansiere renere vand ved at skære i velfærden for børn, ældre og udsatte. I stedet skal vi tænke helhedsorienteret: søge statslige og regionale midler, arbejde tættere sammen med forsyningsselskaberne og sikre, at de investeringer vi laver i dag, betaler sig i form af både renere vand og færre klimaskader i fremtiden. Så ja, vi skal prioritere indsatsen - men uden at gøre det på bekostning af de borgere, der har mest brug for fællesskabet.",1,"Det er også en kommunal opgave at sikre ordentlig hygiejne hos sårbare borgere, hvor det er nødvendigt. Dog, teknologi og kunstig intelligens skal være et supplement til den offentlige velfærd, ikke en erstatning! Så når vi f.eks. indfører robotstøvsugere og chatbots, så skal det være for at frigive tid for de ansatte der servicerer borgerne, så der er flere ressourcer til kvalificeret pleje, social kontakt og grundig sagsbehandling.",3,"Jeg vil gerne fremme grøn transport og gøre det lettere at vælge elbil. Derfor giver det mening, at flere parkeringspladser reserveres til elbiler - især dér, hvor der opsættes ladestandere. Men det skal ske klogt og gradvist, så der stadig er parkeringsmuligheder for andre borgere, og så omstillingen opleves som en hjælp og ikke som en straf. Mit mål er, at den grønne omstilling bliver attraktiv og tilgængelig for alle.",3,"Det er jeg fordi vi skal gøre det nemt og attraktivt at vælge cyklen,  og gode forhold for fodgængere. Det handler om at skabe sundere byer og en grønnere fremtid.",3,"Jeg mener, at vi skal nedbringe CO2-udslippet i Rudersdal, fordi klimahandling er en investering i vores fælles fremtid. Men det skal gøres klogt og retfærdigt, så regningen ikke væltes over på dem med mindst at rutte med. Grønne løsninger kan på sigt gøre det billigere at bo og leve i kommunen, hvis vi investerer rigtigt nu.",4,"Jeg mener, at de grønne områder er Rudersdals største styrke - de giver natur, rekreation, klima- og biodiversitetsgevinster. Derfor skal vi beskytte dem frem for at bygge dem væk. Selvfølgelig kan der være behov for nyt byggeri, men det skal ske ved fortætning og omdannelse af allerede bebyggede arealer, ikke på bekostning af vores natur.",3,"Jeg vil styrke kultur- og fritidstilbud til børn og unge, fordi det skaber fællesskaber, trivsel og forebygger ensomhed og mistrivsel. Men jeg ønsker ikke at finansiere det ved at skære i andre velfærdsområder som skoler eller ældrepleje. Jeg vil i stedet finde nye løsninger, søge samarbejde med foreninger og staten, og prioritere klogt i budgettet. Børn og unges fællesskaber er en investering i fremtiden - men det må ikke ske ved at stille velfærdsområder op mod hinanden.",1,"Jeg er ikke enig. Kunst og kultur er ikke pynt - det er fællesskab, dannelse og livskvalitet. I Rudersdal skal vi selvfølgelig have styr på økonomien, men kulturudgifterne er en lille del af budgettet og giver til gengæld rigtig meget tilbage: stærke fællesskaber, sunde børn og unge, og et levende lokalsamfund, hvor vi også mødes på tværs af alder og baggrund. SF mener, at vi skal passe på vores kulturtilbud - ikke skære dem ned",3,"Ja, vi har brug for hænder i Rudersdal, og kommunen skal være aktiv i at tiltrække udenlandsk arbejdskraft, hvor der er ubesatte stillinger - men det skal ske på ordentlige vilkår. For SF er det vigtigt, at udenlandske medarbejdere får gode arbejdsforhold, fair løn og mulighed for at blive en del af fællesskabet. Og så skal vi samtidig investere i uddannelse og opkvalificering af de borgere, der allerede bor her. Vi skal både kunne tiltrække nye kræfter udefra og styrke dem, der er her i forvejen.",0,"Jeg er uenig. En kommune skal kendes på, hvordan den behandler sine mest udsatte borgere. Hjælpen til mennesker i svære livssituationer er ikke en luksus - det er en forudsætning for, at vi kan have et trygt og velfungerende lokalsamfund. Når vi støtter udsatte borgere, forebygger vi større problemer senere, både menneskeligt og økonomisk. SF i Rudersdal mener, at fællesskabet skal bære, når livet bliver svært - for vi kan alle få brug for hjælpen en dag.",1,"Det er rigtigt, at mange steder i Rudersdal fungerer ældreplejen godt, og vi har dygtige medarbejdere, der hver dag yder en kæmpe indsats. Men vi kan ikke læne os tilbage. Vi hører stadig om for lidt tid til den enkelte, stressede medarbejdere og for mange vikarer. Derfor vil vi styrke ældreområdet, så vi kan sikre nærvær, kontinuitet og kvalitet - uanset hvor i kommunen man bor. Der er meget, der fungerer, men vi kan og skal gøre det endnu bedre.",1,"Jeg mener, at vi kan organisere ældreplejen klogere og fjerne noget bureaukrati, men hvis vi vil have en markant bedre ældrepleje med mere tid, nærvær og kontinuitet, kræver det flere hænder - og dermed flere ressourcer. Dygtige medarbejdere skal have tid til at være sammen med de ældre, og det får vi ikke uden at prioritere området højere.",3,"Jeg mener, at gratis og sund mad til børn er en god investering i trivsel, læring og lighed. Men jeg ønsker ikke, at det skal finansieres ved at skære i andre velfærdsområder. Derfor vil jeg arbejde for, at vi kan indføre madordninger gradvist, finde finansiering gennem omprioriteringer eller eksterne midler - og samtidig sikre, at kvaliteten i både skole og dagtilbud ikke lider under det.",3,"Jeg mener, at røgfri zoner er med til at skabe sundere og mere trygge fællesområder, især dér hvor børn og unge færdes. Samtidig skal vi sikre, at der stadig er plads til alle borgere, så det handler om at finde en rimelig balance mellem hensynet til folkesundhed og frihed.",2,"Jeg forstår godt ønsket om længere åbningstider, for familierne har forskellige behov. Men SF mener ikke, at vi skal udvide åbningstiderne, hvis det betyder dårligere normeringer eller besparelser på andre velfærdsområder. For os er kvaliteten i daginstitutionerne vigtigere end at have åbent endnu længere - børnene har brug for nærvær og tryghed, ikke blot flere timer i store grupper. Hvis der er et dokumenteret behov, skal vi se på fleksible løsninger, men det må ikke ske på bekostning af børnenes trivsel.",3,"Jeg mener, at færre elever i klasserne giver bedre trivsel og læring, fordi læreren får mere tid til den enkelte elev. Men jeg ønsker ikke, at det sker ved at skære i andre velfærdsområder som ældreplejen eller daginstitutionerne. For mig handler det om at prioritere skolen højere og finde løsninger, der styrker kvaliteten uden at stille velfærden op mod hinanden.",3,"Ja, men det skal ske på en måde, der giver mening for både borgere og virksomheder.  Rudersdal skal være en attraktiv kommune at drive virksomhed i - især for grønne, bæredygtige og socialt ansvarlige virksomheder. Når vi tiltrækker private arbejdspladser, skal det være jobs, der bidrager til lokal udvikling, klimaomstilling og ordentlige arbejdsvilkår. Og samtidig skal vi investere i uddannelse og infrastruktur, så både virksomheder og medarbejdere har lyst til at blive i kommunen.",1,"Jeg er ikke enig. De kommunalt ansatte er fundamentet for den velfærd, vi alle nyder godt af - de passer vores børn, underviser i skolen, tager sig af ældre og holder kommunen kørende. Færre ansatte betyder færre hænder til de opgaver, vi som borgere forventer bliver løst ordentligt. SF vil i stedet have, at medarbejderne får bedre rammer og mindre bureaukrati, så de kan bruge tiden på mennesker frem for papirarbejde. Vi skal have effektivitet - men ikke på bekostning af velfærden.",1,"Jeg mener, at vores skat skal bruges på stærk velfærd, grøn omstilling og fællesskab - ikke på skattelettelser. Rudersdal har en sund økonomi, og det giver os mulighed for at investere i børn, ældre og klima i stedet for at skære ned. Jeg vil hellere have gode skoler, tryg ældrepleje og grønne løsninger end en lille skattenedsættelse.",3,"Rudersdal har en sund økonomi, og mange af de penge, vi betaler i skat, går til kernevelfærd som skoler, ældrepleje og daginstitutioner.  Jeg mener dog, at vi altid kan bruge pengene endnu klogere: mere på klima og grøn omstilling, mere på tryghed og fællesskab. Skatten skal opleves som en investering i fællesskabet, og der kan vi stadig prioritere bedre.",3,"Jeg er tryg ved, at Rudersdal Kommune har beredskab og planer, hvis vi rammes af storme eller oversvømmelser. Men jeg mener, at vi skal være endnu bedre forberedt. Klimaforandringerne gør ekstreme vejrfænomener mere sandsynlige, og derfor skal vi investere i klimatilpasning - f.eks. bedre afledning af regnvand, flere grønne områder og styrket samarbejde med beredskabet. Tryghed handler ikke kun om at reagere, når skaden sker, men om at forebygge klogt, så borgere og bygninger er bedre sikret på forhånd","Miljø og klima, Social- og integrationsområdet, Ældre, Sundhed, Skole/dagtilbud for børn","Du bør stemme på mig, fordi Jeg kæmper for et grønt Rudersdal med 100 % vedvarende energi, bedre trivsel for børn og unge samt en tryg alderdom med flere varme hænder og nye boligformer.","Du bør stemme på mig, fordi jeg vil kæmpe for en grønnere, mere retfærdig og tryg Rudersdal. 🌱 Jeg vil have en kommune, der går forrest i klimakampen: 100 % vedvarende energi, udbygning af fjernvarmen og grønne løsninger til alle områder - med borgerinddragelse og handling bag klimahandlingsplanen. 👦 Jeg vil sikre børn og unges trivsel med flere voksne i daginstitutionerne, bedre rammer i skolen, stop for besparelser, gratis skolemad, adgang til psykologhjælp og fripas til fritidsaktiviteter. 👵 Og jeg vil skabe en tryg alderdom med faste teams i hjemmeplejen, bedre arbejdsvilkår, mere tid til nærvær samt nye boligformer som seniorfællesskaber og oldekoller. Kort sagt: En kommune med grøn omstilling, stærk velfærd og fællesskab i centrum."
